main_category_id,main_category,subcategory,service,serviceLink
10,"Trade, Business & Industry",Registrations - Establishments,Society Registration,https://gic.gov.lk/gic/index.php/en/component/info/?id=1217&catid=56&task=info
10,"Trade, Business & Industry",Registrations - Establishments,Factory Registration,https://gic.gov.lk/gic/index.php/en/component/info/?id=1174&catid=56&task=info
10,"Trade, Business & Industry","Approvals, Permits & Licenses",Grant approval for Imports on Duty Free Basis,https://gic.gov.lk/gic/index.php/en/component/info/?id=1278&catid=57&task=info
10,"Trade, Business & Industry","Approvals, Permits & Licenses",Grant approval to set up Investment Projects,https://gic.gov.lk/gic/index.php/en/component/info/?id=1270&catid=57&task=info
10,"Trade, Business & Industry","Approvals, Permits & Licenses","Obtain Pattern Approval for weights, Measures, Measuring instruments",https://gic.gov.lk/gic/index.php/en/component/info/?id=859&catid=57&task=info
10,"Trade, Business & Industry","Approvals, Permits & Licenses",License to Import Free Trade Samples - Unit 1,https://gic.gov.lk/gic/index.php/en/component/info/?id=414&catid=57&task=info
10,"Trade, Business & Industry","Approvals, Permits & Licenses",Grant approval to sell redundant items in the Local Market,https://gic.gov.lk/gic/index.php/en/component/info/?id=1645&catid=57&task=info
10,"Trade, Business & Industry","Approvals, Permits & Licenses",Obtain License for Exports of Miscellaneous Items - Unit 4/5,https://gic.gov.lk/gic/index.php/en/component/info/?id=433&catid=57&task=info
10,"Trade, Business & Industry","Approvals, Permits & Licenses",Pawnbrokers License,https://gic.gov.lk/gic/index.php/en/component/info/?id=566&catid=57&task=info
10,"Trade, Business & Industry","Approvals, Permits & Licenses",Block License - Unit 1,https://gic.gov.lk/gic/index.php/en/component/info/?id=410&catid=57&task=info
10,"Trade, Business & Industry","Approvals, Permits & Licenses",Liquor Permit,https://gic.gov.lk/gic/index.php/en/component/info/?id=565&catid=57&task=info
10,"Trade, Business & Industry","Approvals, Permits & Licenses",Amended Licenses for Importation of Drugs - Unit 1,https://gic.gov.lk/gic/index.php/en/component/info/?id=412&catid=57&task=info
10,"Trade, Business & Industry","Approvals, Permits & Licenses","Importation of Chemicals (Chemicals, Animal Products and Herbal Products Import License) - Unit 3",https://gic.gov.lk/gic/index.php/en/component/info/?id=428&catid=57&task=info
10,"Trade, Business & Industry","Approvals, Permits & Licenses",Issue Sri Lanka Certificate of Origin (COO),https://gic.gov.lk/gic/index.php/en/component/info/?id=1291&catid=57&task=info
10,"Trade, Business & Industry","Approvals, Permits & Licenses",Debit Goods Imported - Unit 1,https://gic.gov.lk/gic/index.php/en/component/info/?id=411&catid=57&task=info
10,"Trade, Business & Industry","Approvals, Permits & Licenses",Application for Permission to Use the Title of Ayurveda,https://gic.gov.lk/gic/index.php/en/component/info/?id=920&catid=57&task=info
10,"Trade, Business & Industry","Approvals, Permits & Licenses",Part Shipment Licenses - Unit 1,https://gic.gov.lk/gic/index.php/en/component/info/?id=409&catid=57&task=info
10,"Trade, Business & Industry","Approvals, Permits & Licenses",Import License for the Explosives,https://gic.gov.lk/gic/index.php/en/component/info/?id=1151&catid=57&task=info
10,"Trade, Business & Industry","Approvals, Permits & Licenses",Grant approval to Transfer Raw Materials or Accessories,https://gic.gov.lk/gic/index.php/en/component/info/?id=1290&catid=57&task=info
10,"Trade, Business & Industry","Approvals, Permits & Licenses",Grant approval for Exports of products,https://gic.gov.lk/gic/index.php/en/component/info/?id=1279&catid=57&task=info
10,"Trade, Business & Industry","Approvals, Permits & Licenses",Grant approval to sell finished products in the Local Market,https://gic.gov.lk/gic/index.php/en/component/info/?id=1285&catid=57&task=info
10,"Trade, Business & Industry","Approvals, Permits & Licenses",Obtaining Debiting License for Imported Chemicals Unit 3/4,https://gic.gov.lk/gic/index.php/en/component/info/?id=429&catid=57&task=info
10,"Trade, Business & Industry","Approvals, Permits & Licenses",Grant approval for Indirect Exports,https://gic.gov.lk/gic/index.php/en/component/info/?id=1292&catid=57&task=info
10,"Trade, Business & Industry","Approvals, Permits & Licenses",Amended Licenses Import of Chemicals Unit 3/4,https://gic.gov.lk/gic/index.php/en/component/info/?id=431&catid=57&task=info
10,"Trade, Business & Industry","Approvals, Permits & Licenses",Transporting Parcels by Trains,https://gic.gov.lk/gic/index.php/en/component/info/?id=465&catid=57&task=info
10,"Trade, Business & Industry","Approvals, Permits & Licenses",Digging the Roads for Laying Water Pipes,https://gic.gov.lk/gic/index.php/en/component/info/?id=1299&catid=57&task=info
10,"Trade, Business & Industry","Approvals, Permits & Licenses",Hiring of Play Grounds and Halls Belonging to the Pradeshiya Sabha,https://gic.gov.lk/gic/index.php/en/component/info/?id=1298&catid=57&task=info
10,"Trade, Business & Industry","Approvals, Permits & Licenses",Approval for the transfer of raw material or accessories between BOI approved projects.,https://gic.gov.lk/gic/index.php/en/component/info/?id=1287&catid=57&task=info
10,"Trade, Business & Industry","Assistance, Training & Development",NDT Inspection Services,https://gic.gov.lk/gic/index.php/en/component/info/?id=2033&catid=58&task=info
10,"Trade, Business & Industry","Assistance, Training & Development",Provision of Industrial Information and Consultancy Services,https://gic.gov.lk/gic/index.php/en/component/info/?id=1697&catid=58&task=info
10,"Trade, Business & Industry","Assistance, Training & Development",Development Programmes for Private Public Partnership,https://gic.gov.lk/gic/index.php/en/component/info/?id=823&catid=58&task=info
10,"Trade, Business & Industry","Assistance, Training & Development",Implementation of Technical Education Development Programmes - Specialized for North East Provinces,https://gic.gov.lk/gic/index.php/en/component/info/?id=824&catid=58&task=info
10,"Trade, Business & Industry","Assistance, Training & Development",Obtaining Government Lands on Lease,https://gic.gov.lk/gic/index.php/en/component/info/?id=559&catid=58&task=info
10,"Trade, Business & Industry","Assistance, Training & Development",The Unauthorized Developed Land Obtaining on Lease,https://gic.gov.lk/gic/index.php/en/component/info/?id=560&catid=58&task=info
10,"Trade, Business & Industry","Assistance, Training & Development",Obtain of State Lands for Various Endeavor on Short Terms Leases,https://gic.gov.lk/gic/index.php/en/component/info/?id=597&catid=58&task=info
10,"Trade, Business & Industry","Assistance, Training & Development",Obtain of Long Term Lease Bonds for Special Projects,https://gic.gov.lk/gic/index.php/en/component/info/?id=593&catid=58&task=info
10,"Trade, Business & Industry","Assistance, Training & Development",Releasing of Lands to Government Departments,https://gic.gov.lk/gic/index.php/en/component/info/?id=595&catid=58&task=info
10,"Trade, Business & Industry",Facilitations,Grant approval to set up incentivised Investment Projects,https://gic.gov.lk/gic/index.php/en/component/info/?id=1269&catid=59&task=info
10,"Trade, Business & Industry",Facilitations,Grant approval to set up Investment Projects,https://gic.gov.lk/gic/index.php/en/component/info/?id=1270&catid=59&task=info
10,"Trade, Business & Industry",Facilitations,NDT Inspection Services,https://gic.gov.lk/gic/index.php/en/component/info/?id=2033&catid=59&task=info
10,"Trade, Business & Industry",Facilitations,Find Employment through  “BOI Zonal Job Banks”,https://gic.gov.lk/gic/index.php/en/component/info/?id=1274&catid=59&task=info
10,"Trade, Business & Industry",Facilitations,Personal Monitoring Service,https://gic.gov.lk/gic/index.php/en/component/info/?id=2031&catid=59&task=info
10,"Trade, Business & Industry",Facilitations,Obtain License for Imports of Miscellaneous Items Unit 4,https://gic.gov.lk/gic/index.php/en/component/info/?id=435&catid=59&task=info
10,"Trade, Business & Industry",Facilitations,Dosimetry Calibration Laboratory service,https://gic.gov.lk/gic/index.php/en/component/info/?id=2030&catid=59&task=info
10,"Trade, Business & Industry",Standards,Personal Monitoring Service,https://gic.gov.lk/gic/index.php/en/component/info/?id=2031&catid=60&task=info
10,"Trade, Business & Industry",Standards,Dosimetry Calibration Laboratory service,https://gic.gov.lk/gic/index.php/en/component/info/?id=2030&catid=60&task=info
10,"Trade, Business & Industry",Standards,Product Certification Scheme (SLS Marks scheme),https://gic.gov.lk/gic/index.php/en/component/info/?id=1141&catid=60&task=info
10,"Trade, Business & Industry",Standards,Standards Formulation,https://gic.gov.lk/gic/index.php/en/component/info/?id=1528&catid=60&task=info
10,"Trade, Business & Industry",Standards,Tea Certification,https://gic.gov.lk/gic/index.php/en/component/info/?id=2087&catid=60&task=info
10,"Trade, Business & Industry",Standards,Control/Eliminate Restrictive Trade Agreements Among Traders,https://gic.gov.lk/gic/index.php/en/component/info/?id=524&catid=60&task=info
10,"Trade, Business & Industry","Loans, Funds & Incentive Schemes",Grant approval to set up incentivised Investment Projects,https://gic.gov.lk/gic/index.php/en/component/info/?id=1269&catid=61&task=info
10,"Trade, Business & Industry","Loans, Funds & Incentive Schemes",Providing Bonds & Guarantees,https://gic.gov.lk/gic/index.php/en/component/info/?id=1790&catid=61&task=info
10,"Trade, Business & Industry","Loans, Funds & Incentive Schemes",Registration for Kalayatana (Art Schools),https://gic.gov.lk/gic/index.php/en/component/info/?id=629&catid=61&task=info
10,"Trade, Business & Industry","Loans, Funds & Incentive Schemes",Financial Assistance for Journalists Training Courses,https://gic.gov.lk/gic/index.php/en/component/info/?id=762&catid=61&task=info
10,"Trade, Business & Industry",Information,Grant approval to set up incentivised Investment Projects,https://gic.gov.lk/gic/index.php/en/component/info/?id=1269&catid=62&task=info
10,"Trade, Business & Industry",Information,Provision of Industrial Information and Consultancy Services,https://gic.gov.lk/gic/index.php/en/component/info/?id=1697&catid=62&task=info
10,"Trade, Business & Industry",Information,Find Employment through  “BOI Zonal Job Banks”,https://gic.gov.lk/gic/index.php/en/component/info/?id=1274&catid=62&task=info
10,"Trade, Business & Industry",Information,Provide Contact Details of BOI Approved Projects,https://gic.gov.lk/gic/index.php/en/component/info/?id=1276&catid=62&task=info
10,"Trade, Business & Industry",Information,"Obtaining Schedules of Census and Surveys, Reports, Statistical Data",https://gic.gov.lk/gic/index.php/en/component/info/?id=837&catid=62&task=info
10,"Trade, Business & Industry",Information,Obtaining Micro Data Files,https://gic.gov.lk/gic/index.php/en/component/info/?id=836&catid=62&task=info
10,"Trade, Business & Industry",Information,Find lands  through the “BOI Land Bank”,https://gic.gov.lk/gic/index.php/en/component/info/?id=1272&catid=62&task=info
10,"Trade, Business & Industry",Information,Market Surveys & Market Reserch,https://gic.gov.lk/gic/index.php/en/component/info/?id=521&catid=62&task=info
10,"Trade, Business & Industry",Information,Provide Performance Details of BOI Approved Projects,https://gic.gov.lk/gic/index.php/en/component/info/?id=1277&catid=62&task=info
10,"Trade, Business & Industry",Information,Inform about hazards,https://gic.gov.lk/gic/index.php/en/component/info/?id=1211&catid=62&task=info
10,"Trade, Business & Industry",Information,Trader Awareness Programs,https://gic.gov.lk/gic/index.php/en/component/info/?id=519&catid=62&task=info
10,"Trade, Business & Industry",Information,Broadcasting of Obituary Notice Over the Radio,https://gic.gov.lk/gic/index.php/en/component/info/?id=743&catid=62&task=info
10,"Trade, Business & Industry",Information,Conduct of Ayruvedic Exhibitions,https://gic.gov.lk/gic/index.php/en/component/info/?id=950&catid=62&task=info
10,"Trade, Business & Industry",Information,Building  limit,https://gic.gov.lk/gic/index.php/en/component/info/?id=1873&catid=62&task=info
10,"Trade, Business & Industry",Extensions & Other Services,Reserve a Circuit Bungalow,https://gic.gov.lk/gic/index.php/en/component/info/?id=1212&catid=63&task=info
10,"Trade, Business & Industry",Transport Services,Sri Lanka Transport Board,https://gic.gov.lk/gic/index.php/en/component/info/?id=650&catid=64&task=info
10,"Trade, Business & Industry",Transport Services,Sri Lanka Railways,https://gic.gov.lk/gic/index.php/en/component/info/?id=647&catid=64&task=info
10,"Trade, Business & Industry",Transport Services,Issuing Railway Seasons Tickets,https://gic.gov.lk/gic/index.php/en/component/info/?id=466&catid=64&task=info
10,"Trade, Business & Industry",Transport Services,Obtain New Vehicle License (Three Wheeler / Motor Cycles) from Divisional Secretariat,https://gic.gov.lk/gic/index.php/en/component/info/?id=586&catid=64&task=info
10,"Trade, Business & Industry",Transport Services,Instant Receipt of EMS Goods Sent From Foreign Countries for Delivery in Sri Lanka,https://gic.gov.lk/gic/index.php/en/component/info/?id=748&catid=64&task=info
10,"Trade, Business & Industry",Transport Services,Obtain Conductors License,https://gic.gov.lk/gic/index.php/en/component/info/?id=568&catid=64&task=info
10,"Trade, Business & Industry",Motoring,Obtaining a New Driving License,https://gic.gov.lk/gic/index.php/en/component/info/?id=390&catid=65&task=info
10,"Trade, Business & Industry",Motoring,Registration of Transfer of Motor Vehicle,https://gic.gov.lk/gic/index.php/en/component/info/?id=413&catid=65&task=info
10,"Trade, Business & Industry",Motoring,Renewing of Driving License,https://gic.gov.lk/gic/index.php/en/component/info/?id=397&catid=65&task=info
10,"Trade, Business & Industry",Motoring,Registering a New Motor Vehicle,https://gic.gov.lk/gic/index.php/en/component/info/?id=408&catid=65&task=info
10,"Trade, Business & Industry",Motoring,Import of Vehicles on Foreign Earnings - Unit 2,https://gic.gov.lk/gic/index.php/en/component/info/?id=415&catid=65&task=info
10,"Trade, Business & Industry",Motoring,Obtaining a Duplicate of a Driving License,https://gic.gov.lk/gic/index.php/en/component/info/?id=393&catid=65&task=info
10,"Trade, Business & Industry",Motoring,Import of Vehicles Under Gift Scheme - Unit 2,https://gic.gov.lk/gic/index.php/en/component/info/?id=420&catid=65&task=info
10,"Trade, Business & Industry",Motoring,Obtaining Fine Receipts and Payments,https://gic.gov.lk/gic/index.php/en/component/info/?id=475&catid=65&task=info
10,"Trade, Business & Industry",Motoring,Obtaining a Temporary Driving License,https://gic.gov.lk/gic/index.php/en/component/info/?id=395&catid=65&task=info
10,"Trade, Business & Industry",Motoring,PMU - Functions and Services,https://gic.gov.lk/gic/index.php/en/component/info/?id=1176&catid=65&task=info
10,"Trade, Business & Industry",Motoring,Obtaining a Certification for Driving License,https://gic.gov.lk/gic/index.php/en/component/info/?id=400&catid=65&task=info
10,"Trade, Business & Industry",Motoring,Extending Validity of Driving License,https://gic.gov.lk/gic/index.php/en/component/info/?id=398&catid=65&task=info
10,"Trade, Business & Industry",Motoring,Importation of Vehicles Under the Gift Scheme for Organizations - Unit 2,https://gic.gov.lk/gic/index.php/en/component/info/?id=424&catid=65&task=info
10,"Trade, Business & Industry",Motoring,Renewal of Vehicle License Through Divisional Secretariat,https://gic.gov.lk/gic/index.php/en/component/info/?id=587&catid=65&task=info
10,"Trade, Business & Industry",Motoring,Obtaining a Driving License Card in Replacement of an Old License Booklet,https://gic.gov.lk/gic/index.php/en/component/info/?id=402&catid=65&task=info
10,"Trade, Business & Industry",Motoring,Obtaining a New Driving License with Amended Names / Addresses / Classes,https://gic.gov.lk/gic/index.php/en/component/info/?id=404&catid=65&task=info
10,"Trade, Business & Industry",Motoring,Importation of Body Shells - Unit 2,https://gic.gov.lk/gic/index.php/en/component/info/?id=426&catid=65&task=info
10,"Trade, Business & Industry",Motoring,Importation of Used Motor Cycles and Cars for Re-export After Repairing - Unit 2,https://gic.gov.lk/gic/index.php/en/component/info/?id=427&catid=65&task=info
10,"Trade, Business & Industry",Motoring,"Helicopter, Air Craft and Spare Parts - Unit 2",https://gic.gov.lk/gic/index.php/en/component/info/?id=425&catid=65&task=info
10,"Trade, Business & Industry",Motoring,Obtaining Assistance in Filling Insurance Forms,https://gic.gov.lk/gic/index.php/en/component/info/?id=478&catid=65&task=info
10,"Trade, Business & Industry",Motoring,Importing Vehicles,https://gic.gov.lk/gic/index.php/en/component/info/?id=1534&catid=65&task=info
11,Communication & Media,Languages,Publications,https://gic.gov.lk/gic/index.php/en/component/info/?id=617&catid=81&task=info
11,Communication & Media,Languages,Language Translation,https://gic.gov.lk/gic/index.php/en/component/info/?id=609&catid=81&task=info
11,Communication & Media,Postal Service,Dispatch of a Foreign Parcel,https://gic.gov.lk/gic/index.php/en/component/info/?id=737&catid=66&task=info
11,Communication & Media,Postal Service,Value Payable Post,https://gic.gov.lk/gic/index.php/en/component/info/?id=721&catid=66&task=info
11,Communication & Media,Postal Service,Handing Over of Letters and Other Postal Articles to be Sent Through Express Post,https://gic.gov.lk/gic/index.php/en/component/info/?id=747&catid=66&task=info
11,Communication & Media,Postal Service,Dispatch of Local Telegrams,https://gic.gov.lk/gic/index.php/en/component/info/?id=738&catid=66&task=info
11,Communication & Media,Postal Service,Obtain of a Fax Money Order,https://gic.gov.lk/gic/index.php/en/component/info/?id=717&catid=66&task=info
11,Communication & Media,Postal Service,Books or Magazines Imported is Bulk From Other Countries,https://gic.gov.lk/gic/index.php/en/component/info/?id=749&catid=66&task=info
11,Communication & Media,Postal Service,"Dispatch of Letters, Printed Matter, Post Card, Small Packets and Express Letters",https://gic.gov.lk/gic/index.php/en/component/info/?id=745&catid=66&task=info
11,Communication & Media,Postal Service,Obtaining a Post Office Box Number,https://gic.gov.lk/gic/index.php/en/component/info/?id=728&catid=66&task=info
11,Communication & Media,Postal Service,Inquiries Relating to Registered Articles,https://gic.gov.lk/gic/index.php/en/component/info/?id=734&catid=66&task=info
11,Communication & Media,Postal Service,Money Order,https://gic.gov.lk/gic/index.php/en/component/info/?id=1162&catid=66&task=info
11,Communication & Media,Postal Service,Dispatch of Telegraph Money Order,https://gic.gov.lk/gic/index.php/en/component/info/?id=716&catid=66&task=info
11,Communication & Media,Postal Service,Business Postal Facilities,https://gic.gov.lk/gic/index.php/en/component/info/?id=750&catid=66&task=info
11,Communication & Media,Postal Service,Action to be Taken in case of Loss of a Money Order (Local),https://gic.gov.lk/gic/index.php/en/component/info/?id=719&catid=66&task=info
11,Communication & Media,Postal Service,Ordinary Money Order,https://gic.gov.lk/gic/index.php/en/component/info/?id=715&catid=66&task=info
11,Communication & Media,Postal Service,Obtaining a Certified Copy of the Delivery Receipt of the Registered Article,https://gic.gov.lk/gic/index.php/en/component/info/?id=735&catid=66&task=info
11,Communication & Media,Postal Service,Withdrawal of a Letter Already Posted,https://gic.gov.lk/gic/index.php/en/component/info/?id=736&catid=66&task=info
11,Communication & Media,Postal Service,"Receipt of Letters, Small Packets and Express Letters Sent by Air Mail and Sea Mail",https://gic.gov.lk/gic/index.php/en/component/info/?id=746&catid=66&task=info
11,Communication & Media,Postal Service,Obtaining the Business Reply Covers and Card Service,https://gic.gov.lk/gic/index.php/en/component/info/?id=732&catid=66&task=info
11,Communication & Media,Postal Service,Bulk Postal Facilities Under the Bulk Post Numbers,https://gic.gov.lk/gic/index.php/en/component/info/?id=733&catid=66&task=info
11,Communication & Media,Postal Service,Foreign Money Orders and British Postal Orders Service,https://gic.gov.lk/gic/index.php/en/component/info/?id=720&catid=66&task=info
11,Communication & Media,Postal Service,Sending Foreign Telegrams,https://gic.gov.lk/gic/index.php/en/component/info/?id=739&catid=66&task=info
11,Communication & Media,Postal Service,Re-validating of a Lapsed Money Order,https://gic.gov.lk/gic/index.php/en/component/info/?id=718&catid=66&task=info
11,Communication & Media,Information Services,Grant approval to set up incentivised Investment Projects,https://gic.gov.lk/gic/index.php/en/component/info/?id=1269&catid=67&task=info
11,Communication & Media,Information Services,PMU - Functions and Services,https://gic.gov.lk/gic/index.php/en/component/info/?id=1176&catid=67&task=info
11,Communication & Media,Information Services,"Obtaining Schedules of Census and Surveys, Reports, Statistical Data",https://gic.gov.lk/gic/index.php/en/component/info/?id=837&catid=67&task=info
11,Communication & Media,Information Services,ICC-  Duplicating VCD/DVD on agricultural TV programmes broadcasted,https://gic.gov.lk/gic/index.php/en/component/info/?id=1345&catid=67&task=info
11,Communication & Media,Information Services,Web Site,https://gic.gov.lk/gic/index.php/en/component/info/?id=833&catid=67&task=info
11,Communication & Media,Information Services,Grant approval to sell redundant items in the Local Market,https://gic.gov.lk/gic/index.php/en/component/info/?id=1645&catid=67&task=info
11,Communication & Media,Information Services,Obtaining Micro Data Files,https://gic.gov.lk/gic/index.php/en/component/info/?id=836&catid=67&task=info
11,Communication & Media,Information Services,National Museum Library,https://gic.gov.lk/gic/index.php/en/component/info/?id=1484&catid=67&task=info
11,Communication & Media,Information Services,ICC: National telecasting on success stories of farmers,https://gic.gov.lk/gic/index.php/en/component/info/?id=1343&catid=67&task=info
11,Communication & Media,Information Services,Geological Maps,https://gic.gov.lk/gic/index.php/en/component/info/?id=1115&catid=67&task=info
11,Communication & Media,Information Services,Library,https://gic.gov.lk/gic/index.php/en/component/info/?id=834&catid=67&task=info
11,Communication & Media,Information Services,Sales Counters,https://gic.gov.lk/gic/index.php/en/component/info/?id=835&catid=67&task=info
11,Communication & Media,Information Services,Other Geological Surveys,https://gic.gov.lk/gic/index.php/en/component/info/?id=1117&catid=67&task=info
11,Communication & Media,Information Services,Rock Laboratory,https://gic.gov.lk/gic/index.php/en/component/info/?id=1120&catid=67&task=info
11,Communication & Media,Information Services,Survey of Mineral Deposits,https://gic.gov.lk/gic/index.php/en/component/info/?id=1116&catid=67&task=info
11,Communication & Media,Licenses & Permits,Department of Motor Traffic,https://gic.gov.lk/gic/index.php/en/component/info/?id=648&catid=68&task=info
11,Communication & Media,Licenses & Permits,"Renewal of Licenses - Repairers, Manufacturers and Sellers",https://gic.gov.lk/gic/index.php/en/component/info/?id=931&catid=68&task=info
11,Communication & Media,Licenses & Permits,"Verifications of weights, Measures and weighing or Measuring Instruments",https://gic.gov.lk/gic/index.php/en/component/info/?id=932&catid=68&task=info
11,Communication & Media,Licenses & Permits,Obtaining a transport license for liqueur,https://gic.gov.lk/gic/index.php/en/component/info/?id=1143&catid=68&task=info
11,Communication & Media,Licenses & Permits,FL 04 Licenses (Super markets which exceeded annual turnover tax  Rs 72 million),https://gic.gov.lk/gic/index.php/en/component/info/?id=1150&catid=68&task=info
11,Communication & Media,Licenses & Permits,Permits for Leaf Dealers,https://gic.gov.lk/gic/index.php/en/component/info/?id=1216&catid=68&task=info
11,Communication & Media,Licenses & Permits,Obtaining a License for Using a Postal Stamp,https://gic.gov.lk/gic/index.php/en/component/info/?id=729&catid=68&task=info
12,Environment,Disaster Relief,Cooked Meals for People Subject to Distress,https://gic.gov.lk/gic/index.php/en/component/info/?id=874&catid=92&task=info
12,Environment,Disaster Relief,Funeral Aids In Respect of Those Who Died of Disaster,https://gic.gov.lk/gic/index.php/en/component/info/?id=876&catid=92&task=info
12,Environment,Disaster Relief,Obtaining Relief for Damages Caused to Crops Due to Any Disaster or Attack by Wild Elephant,https://gic.gov.lk/gic/index.php/en/component/info/?id=881&catid=92&task=info
12,Environment,Disaster Relief,Obtaining Relief for Disasters Faces by Small Scale Entrepreneurs  and the Self Employed,https://gic.gov.lk/gic/index.php/en/component/info/?id=882&catid=92&task=info
12,Environment,Disaster Relief,Dry Rations Meals for People are Subject to Distress,https://gic.gov.lk/gic/index.php/en/component/info/?id=875&catid=92&task=info
12,Environment,Disaster Relief,Obtaining  Dry Ration Relief for Families of Fishermen  Disappeared in the Sea,https://gic.gov.lk/gic/index.php/en/component/info/?id=883&catid=92&task=info
12,Environment,Disaster Management,Preparedness Planning,https://gic.gov.lk/gic/index.php/en/component/info/?id=986&catid=95&task=info
12,Environment,Disaster Management,Seismic Information,https://gic.gov.lk/gic/index.php/en/component/info/?id=1180&catid=95&task=info
12,Environment,Disaster Management,Analysis of Seismic Data and Tsunami Warnings,https://gic.gov.lk/gic/index.php/en/component/info/?id=1118&catid=95&task=info
