main_category_id,main_category,subcategory,service,serviceLink
1,Education & Training,Education Publications,Sales Outlets of Books,https://gic.gov.lk/gic/index.php/en/component/info/?id=665&catid=87&task=info
1,Education & Training,Education Publications,Museum Publications,https://gic.gov.lk/gic/index.php/en/component/info/?id=1481&catid=87&task=info
1,Education & Training,Education Publications,Services of Establishment Unit of Educational Publications Department,https://gic.gov.lk/gic/index.php/en/component/info/?id=662&catid=87&task=info
1,Education & Training,Education Publications,Services of Information Technology Unit of Educational Publications Department,https://gic.gov.lk/gic/index.php/en/component/info/?id=659&catid=87&task=info
1,Education & Training,Education Publications,Warehouses of Educational  Publications Department,https://gic.gov.lk/gic/index.php/en/component/info/?id=664&catid=87&task=info
1,Education & Training,Education Publications,Services of Publishing Unit of Educational  Publications Department,https://gic.gov.lk/gic/index.php/en/component/info/?id=657&catid=87&task=info
1,Education & Training,Education Publications,Services of Investigation Unit of Educational  Publications Department,https://gic.gov.lk/gic/index.php/en/component/info/?id=660&catid=87&task=info
1,Education & Training,Education Publications,Services of Research Unit of Educational  Publications Department,https://gic.gov.lk/gic/index.php/en/component/info/?id=661&catid=87&task=info
1,Education & Training,Education Publications,Provision of Books for Libraries,https://gic.gov.lk/gic/index.php/en/component/info/?id=951&catid=87&task=info
1,Education & Training,Education Publications,Services of Planning Unit of Educational  Publications Department,https://gic.gov.lk/gic/index.php/en/component/info/?id=658&catid=87&task=info
1,Education & Training,Education Publications,Services of Production Unit of Educational Publications Department,https://gic.gov.lk/gic/index.php/en/component/info/?id=656&catid=87&task=info
1,Education & Training,Education Publications,Request for Holding a Mobile Archaeological Book Stall,https://gic.gov.lk/gic/index.php/en/component/info/?id=1085&catid=87&task=info
1,Education & Training,Education Publications,Services of Financial Unit of Educational  Publications Department,https://gic.gov.lk/gic/index.php/en/component/info/?id=663&catid=87&task=info
1,Education & Training,School Education,Payment of Examination Fees,https://gic.gov.lk/gic/index.php/en/component/info/?id=742&catid=14&task=info
1,Education & Training,Higher Education & University Education,Payment of Examination Fees,https://gic.gov.lk/gic/index.php/en/component/info/?id=742&catid=15&task=info
1,Education & Training,Higher Education & University Education,Diploma Examination in Ayurveda (D.A.),https://gic.gov.lk/gic/index.php/en/component/info/?id=919&catid=15&task=info
1,Education & Training,Higher Education & University Education,Education section of the Zoo,https://gic.gov.lk/gic/index.php/en/component/info/?id=608&catid=15&task=info
1,Education & Training,Vocational Education & Training,Payment of Examination Fees,https://gic.gov.lk/gic/index.php/en/component/info/?id=742&catid=16&task=info
1,Education & Training,Vocational Education & Training,Enrollment of Students for the Courses of Colleges of Technology/Technical Colleges,https://gic.gov.lk/gic/index.php/en/component/info/?id=614&catid=16&task=info
1,Education & Training,Vocational Education & Training,Register all TVET institutions,https://gic.gov.lk/gic/index.php/en/component/info/?id=938&catid=16&task=info
1,Education & Training,Vocational Education & Training,Obtain the services of Mahaweli Center,https://gic.gov.lk/gic/index.php/en/component/info/?id=1210&catid=16&task=info
1,Education & Training,Vocational Education & Training,Obtaining Continuous Discharge Certificate (CDC),https://gic.gov.lk/gic/index.php/en/component/info/?id=1606&catid=16&task=info
1,Education & Training,Vocational Education & Training,Providing vocational training for the youths,https://gic.gov.lk/gic/index.php/en/component/info/?id=773&catid=16&task=info
1,Education & Training,Vocational Education & Training,NVQ certificates,https://gic.gov.lk/gic/index.php/en/component/info/?id=944&catid=16&task=info
1,Education & Training,Vocational Education & Training,Accreditation of TVET courses,https://gic.gov.lk/gic/index.php/en/component/info/?id=941&catid=16&task=info
1,Education & Training,Vocational Education & Training,CGTTI,https://gic.gov.lk/gic/index.php/en/component/info/?id=1722&catid=16&task=info
1,Education & Training,Vocational Education & Training,Apprentice Training,https://gic.gov.lk/gic/index.php/en/component/info/?id=1103&catid=16&task=info
1,Education & Training,Vocational Education & Training,Re-validation of Continuous Discharge Certificate (CDC),https://gic.gov.lk/gic/index.php/en/component/info/?id=1607&catid=16&task=info
1,Education & Training,Vocational Education & Training,Vocational Skills for Public and Private Sector Institutions,https://gic.gov.lk/gic/index.php/en/component/info/?id=786&catid=16&task=info
1,Education & Training,Vocational Education & Training,Development Programmes for Private Public Partnership,https://gic.gov.lk/gic/index.php/en/component/info/?id=823&catid=16&task=info
1,Education & Training,Vocational Education & Training,Implementation of Technical Education Development Programmes - Specialized for North East Provinces,https://gic.gov.lk/gic/index.php/en/component/info/?id=824&catid=16&task=info
1,Education & Training,Vocational Education & Training,Obtaining Certificates and Endorsements From the Deck Department,https://gic.gov.lk/gic/index.php/en/component/info/?id=1600&catid=16&task=info
1,Education & Training,Vocational Education & Training,Carrier Guidance and Counseling,https://gic.gov.lk/gic/index.php/en/component/info/?id=616&catid=16&task=info
1,Education & Training,Vocational Education & Training,"Facilitating to the vocational training graduates for further training ,job placement or self employ",https://gic.gov.lk/gic/index.php/en/component/info/?id=777&catid=16&task=info
1,Education & Training,Vocational Education & Training,Conducting career guidance and counseling programs,https://gic.gov.lk/gic/index.php/en/component/info/?id=779&catid=16&task=info
1,Education & Training,Vocational Education & Training,Certificates for Vocational Competencies,https://gic.gov.lk/gic/index.php/en/component/info/?id=620&catid=16&task=info
1,Education & Training,Vocational Education & Training,Obtaining Certificates and Endorsements From the Engineering Department,https://gic.gov.lk/gic/index.php/en/component/info/?id=1602&catid=16&task=info
1,Education & Training,Vocational Education & Training,Information Systems,https://gic.gov.lk/gic/index.php/en/component/info/?id=1423&catid=16&task=info
1,Education & Training,Vocational Education & Training,Conducting Trade Test according to  the requirements of institutions,https://gic.gov.lk/gic/index.php/en/component/info/?id=782&catid=16&task=info
1,Education & Training,Vocational Education & Training,Sit for Exams and Obtaining of Certificates,https://gic.gov.lk/gic/index.php/en/component/info/?id=615&catid=16&task=info
1,Education & Training,Vocational Education & Training,Quality Management System (QMS),https://gic.gov.lk/gic/index.php/en/component/info/?id=1267&catid=16&task=info
1,Education & Training,Vocational Education & Training,National Vocational Test,https://gic.gov.lk/gic/index.php/en/component/info/?id=1105&catid=16&task=info
1,Education & Training,Vocational Education & Training,Placement for Employment,https://gic.gov.lk/gic/index.php/en/component/info/?id=618&catid=16&task=info
1,Education & Training,Vocational Education & Training,Traning center,https://gic.gov.lk/gic/index.php/en/component/info/?id=1109&catid=16&task=info
1,Education & Training,Vocational Education & Training,Entrepreneurship Development programs,https://gic.gov.lk/gic/index.php/en/component/info/?id=781&catid=16&task=info
1,Education & Training,Vocational Education & Training,Research Cell,https://gic.gov.lk/gic/index.php/en/component/info/?id=1421&catid=16&task=info
1,Education & Training,Vocational Education & Training,Communication with World Community in Coordinating with IVETA.,https://gic.gov.lk/gic/index.php/en/component/info/?id=821&catid=16&task=info
1,Education & Training,Vocational Education & Training,Financial Assistant,https://gic.gov.lk/gic/index.php/en/component/info/?id=1420&catid=16&task=info
1,Education & Training,Vocational Education & Training,Recognition of Prior Learning,https://gic.gov.lk/gic/index.php/en/component/info/?id=1166&catid=16&task=info
1,Education & Training,Vocational Education & Training,Build the Cordination with Secondry Education Sector in Giving Priority for Inovations.,https://gic.gov.lk/gic/index.php/en/component/info/?id=822&catid=16&task=info
1,Education & Training,Vocational Education & Training,Obtaining Necessary Services under Different Field from the Production Units,https://gic.gov.lk/gic/index.php/en/component/info/?id=783&catid=16&task=info
1,Education & Training,Vocational Education & Training,Improving of International Cooperation for Development of Technical Education.,https://gic.gov.lk/gic/index.php/en/component/info/?id=820&catid=16&task=info
1,Education & Training,Vocational Education & Training,National School of Business Management Limited (NSBM),https://gic.gov.lk/gic/index.php/en/component/info/?id=2254&catid=16&task=info
1,Education & Training,Vocational Education & Training,Awareness Programme for Entrepreneurship Development,https://gic.gov.lk/gic/index.php/en/component/info/?id=619&catid=16&task=info
1,Education & Training,Vocational Education & Training,Vocational Education Training (VET) Plans,https://gic.gov.lk/gic/index.php/en/component/info/?id=943&catid=16&task=info
1,Education & Training,Education for Differently-abled,Payment of Examination Fees,https://gic.gov.lk/gic/index.php/en/component/info/?id=742&catid=17&task=info
1,Education & Training,Distance Education,Payment of Examination Fees,https://gic.gov.lk/gic/index.php/en/component/info/?id=742&catid=18&task=info
1,Education & Training,Education for Government Officers,Payment of Examination Fees,https://gic.gov.lk/gic/index.php/en/component/info/?id=742&catid=20&task=info
1,Education & Training,Education for Government Officers,Official Languages Proficiencies Exam,https://gic.gov.lk/gic/index.php/en/component/info/?id=601&catid=20&task=info
1,Education & Training,Education for Government Officers,Courses for Human Resource Management,https://gic.gov.lk/gic/index.php/en/component/info/?id=2114&catid=20&task=info
1,Education & Training,Education for Government Officers,Proficiencies Exam for Other Languages,https://gic.gov.lk/gic/index.php/en/component/info/?id=606&catid=20&task=info
1,Education & Training,Education for Government Officers,Courses for Labour Law & Industrial Relations,https://gic.gov.lk/gic/index.php/en/component/info/?id=2113&catid=20&task=info
1,Education & Training,Education for Government Officers,Courses for Workplace Productivity,https://gic.gov.lk/gic/index.php/en/component/info/?id=2115&catid=20&task=info
1,Education & Training,Education for Government Officers,Language Training,https://gic.gov.lk/gic/index.php/en/component/info/?id=2121&catid=20&task=info
1,Education & Training,Education for Government Officers,Conducting Examinations,https://gic.gov.lk/gic/index.php/en/component/info/?id=2118&catid=20&task=info
1,Education & Training,Education for Government Officers,On Demand Training,https://gic.gov.lk/gic/index.php/en/component/info/?id=2120&catid=20&task=info
1,Education & Training,Education for Government Officers,Consultancy,https://gic.gov.lk/gic/index.php/en/component/info/?id=2117&catid=20&task=info
1,Education & Training,Education for Government Officers,Research,https://gic.gov.lk/gic/index.php/en/component/info/?id=2116&catid=20&task=info
2,"Housing, Property & Utilities",Infrastructure,Sales of Sea Sand,https://gic.gov.lk/gic/index.php/en/component/info/?id=1804&catid=75&task=info
2,"Housing, Property & Utilities",Infrastructure,Maintaining Continuous Operation at Pumping Stations in Urban Housing Projects,https://gic.gov.lk/gic/index.php/en/component/info/?id=669&catid=75&task=info
2,"Housing, Property & Utilities",Infrastructure,Rural Development Programme,https://gic.gov.lk/gic/index.php/en/component/info/?id=499&catid=75&task=info
2,"Housing, Property & Utilities",Infrastructure,Infrastructure Development in the Lagging Regions of Plantation Areas,https://gic.gov.lk/gic/index.php/en/component/info/?id=2283&catid=75&task=info
2,"Housing, Property & Utilities",Housing & Property,Legal Activities of National Housing Development Authority,https://gic.gov.lk/gic/index.php/en/component/info/?id=673&catid=21&task=info
2,"Housing, Property & Utilities",Housing & Property,NDT Inspection Services,https://gic.gov.lk/gic/index.php/en/component/info/?id=2033&catid=21&task=info
2,"Housing, Property & Utilities",Housing & Property,Survey Activities,https://gic.gov.lk/gic/index.php/en/component/info/?id=671&catid=21&task=info
2,"Housing, Property & Utilities",Housing & Property,L.L. permit to a Jayabhumi / Swarnabhumi grant,https://gic.gov.lk/gic/index.php/en/component/info/?id=558&catid=21&task=info
2,"Housing, Property & Utilities",Housing & Property,Obtaining a Government Land Free of Charge,https://gic.gov.lk/gic/index.php/en/component/info/?id=556&catid=21&task=info
2,"Housing, Property & Utilities",Housing & Property,Sale of Houses,https://gic.gov.lk/gic/index.php/en/component/info/?id=670&catid=21&task=info
2,"Housing, Property & Utilities",Housing & Property,Obtain Serviced Land Plots for Construction of Houses.,https://gic.gov.lk/gic/index.php/en/component/info/?id=672&catid=21&task=info
2,"Housing, Property & Utilities",Housing & Property,Pay Valued Amount of Acquired Lands,https://gic.gov.lk/gic/index.php/en/component/info/?id=561&catid=21&task=info
2,"Housing, Property & Utilities",Housing & Property,Obtaining Permits for Transporting Furniture,https://gic.gov.lk/gic/index.php/en/component/info/?id=564&catid=21&task=info
2,"Housing, Property & Utilities",Housing & Property,Registration of Documents,https://gic.gov.lk/gic/index.php/en/component/info/?id=1622&catid=21&task=info
2,"Housing, Property & Utilities",Housing & Property,Obtaining Free Government Land Developed Unauthorized,https://gic.gov.lk/gic/index.php/en/component/info/?id=557&catid=21&task=info
2,"Housing, Property & Utilities",Housing & Property,Obtaining Housing Grants for Poorest of the Poor Families,https://gic.gov.lk/gic/index.php/en/component/info/?id=667&catid=21&task=info
2,"Housing, Property & Utilities",Housing & Property,Obtain of Ranbima Grant,https://gic.gov.lk/gic/index.php/en/component/info/?id=598&catid=21&task=info
2,"Housing, Property & Utilities",Housing & Property,Obtain of Grants Without Conditions to the people Who had been Issued with Grants with Conditions,https://gic.gov.lk/gic/index.php/en/component/info/?id=604&catid=21&task=info
2,"Housing, Property & Utilities",Housing & Property,Obtain of Long Term Lease Bonds for Residential Purpose,https://gic.gov.lk/gic/index.php/en/component/info/?id=594&catid=21&task=info
2,"Housing, Property & Utilities",Housing & Property,Obtain of Grants for the Permits Issued to the Middle Class,https://gic.gov.lk/gic/index.php/en/component/info/?id=605&catid=21&task=info
2,"Housing, Property & Utilities",Housing & Property,"Permitting Mortgaging, Transferring Instruments of Disposition",https://gic.gov.lk/gic/index.php/en/component/info/?id=600&catid=21&task=info
2,"Housing, Property & Utilities",Housing & Property,Obtain of Grants to Buddhist Temples which are Presently Developed,https://gic.gov.lk/gic/index.php/en/component/info/?id=596&catid=21&task=info
2,"Housing, Property & Utilities",Housing & Property,Obtain of Instruments of Disposition,https://gic.gov.lk/gic/index.php/en/component/info/?id=599&catid=21&task=info
2,"Housing, Property & Utilities",Housing & Property,Provide  House to the  Plantation Community,https://gic.gov.lk/gic/index.php/en/component/info/?id=2274&catid=21&task=info
2,"Housing, Property & Utilities",Planning & Building Regulations,PMU - Functions and Services,https://gic.gov.lk/gic/index.php/en/component/info/?id=1176&catid=22&task=info
2,"Housing, Property & Utilities",Planning & Building Regulations,Obtaining Preliminary Planning Clearance for Development Activities,https://gic.gov.lk/gic/index.php/en/component/info/?id=707&catid=22&task=info
2,"Housing, Property & Utilities",Planning & Building Regulations,Obtaining a Permit for Development Activities,https://gic.gov.lk/gic/index.php/en/component/info/?id=700&catid=22&task=info
2,"Housing, Property & Utilities",Planning & Building Regulations,Obtaining planning clearance for the development of low-lying lands and paddy lands,https://gic.gov.lk/gic/index.php/en/component/info/?id=712&catid=22&task=info
2,"Housing, Property & Utilities",Planning & Building Regulations,Obtaining Preliminary Planning Clearance for Change of Use,https://gic.gov.lk/gic/index.php/en/component/info/?id=708&catid=22&task=info
2,"Housing, Property & Utilities",Planning & Building Regulations,Obtaining a resolution for the environmental Impacts from the development projects,https://gic.gov.lk/gic/index.php/en/component/info/?id=1374&catid=22&task=info
2,"Housing, Property & Utilities",Planning & Building Regulations,Obtaining Preliminary Planning Clearance for BOI Projects,https://gic.gov.lk/gic/index.php/en/component/info/?id=710&catid=22&task=info
2,"Housing, Property & Utilities",Planning & Building Regulations,Obtaining Preliminary Planning Clearance for Hotel Projects,https://gic.gov.lk/gic/index.php/en/component/info/?id=709&catid=22&task=info
2,"Housing, Property & Utilities",Planning & Building Regulations,Obtaining particulars of settlers in the acquired and vested lands of UDA,https://gic.gov.lk/gic/index.php/en/component/info/?id=703&catid=22&task=info
2,"Housing, Property & Utilities",Planning & Building Regulations,Obtaining Preliminary Planning Clearance for Telecommunication Towers,https://gic.gov.lk/gic/index.php/en/component/info/?id=711&catid=22&task=info
2,"Housing, Property & Utilities",Utilities,Electricity Break Down Service and other Particulars.,https://gic.gov.lk/gic/index.php/en/component/info/?id=760&catid=23&task=info
2,"Housing, Property & Utilities",Utilities,Change of the Name of Electricity Consumer,https://gic.gov.lk/gic/index.php/en/component/info/?id=755&catid=23&task=info
2,"Housing, Property & Utilities",Utilities,Obtaining a New Bulk Supply Electricity Service  (Areas other than Colombo City),https://gic.gov.lk/gic/index.php/en/component/info/?id=754&catid=23&task=info
2,"Housing, Property & Utilities",Utilities,Obtaining an Ordinary Supply Electricity Service within Colombo Municipal Limits,https://gic.gov.lk/gic/index.php/en/component/info/?id=751&catid=23&task=info
2,"Housing, Property & Utilities",Utilities,Use of Tele Mail Service,https://gic.gov.lk/gic/index.php/en/component/info/?id=740&catid=23&task=info
2,"Housing, Property & Utilities",Utilities,Obtaining a New Ordinary Electricity Supply (Other than Colombo City),https://gic.gov.lk/gic/index.php/en/component/info/?id=752&catid=23&task=info
2,"Housing, Property & Utilities",Utilities,Change of Tariff,https://gic.gov.lk/gic/index.php/en/component/info/?id=1157&catid=23&task=info
2,"Housing, Property & Utilities",Utilities,Obtaining a New Bulk Supply Electricity Service (Within Colombo City Limits),https://gic.gov.lk/gic/index.php/en/component/info/?id=753&catid=23&task=info
2,"Housing, Property & Utilities",Utilities,Change of the Place where the Meters is Fixed,https://gic.gov.lk/gic/index.php/en/component/info/?id=759&catid=23&task=info
2,"Housing, Property & Utilities",Utilities,Obtaining a Temporary Connection from Another House (Areas Other than the Colombo City),https://gic.gov.lk/gic/index.php/en/component/info/?id=757&catid=23&task=info
2,"Housing, Property & Utilities",Utilities,Obtaining a Temporary Connection  (Areas other than the Colombo City),https://gic.gov.lk/gic/index.php/en/component/info/?id=756&catid=23&task=info
3,"Banking, Tax & Insurance",Leasing Facilities,Leasing,https://gic.gov.lk/gic/index.php/en/component/info/?id=1862&catid=82&task=info
3,"Banking, Tax & Insurance",Miscellaneous,Ceybank Gold Shop,https://gic.gov.lk/gic/index.php/en/component/info/?id=774&catid=90&task=info
3,"Banking, Tax & Insurance",Miscellaneous,NDT Inspection Services,https://gic.gov.lk/gic/index.php/en/component/info/?id=2033&catid=90&task=info
3,"Banking, Tax & Insurance",Miscellaneous,Providing Bonds & Guarantees,https://gic.gov.lk/gic/index.php/en/component/info/?id=1790&catid=90&task=info
3,"Banking, Tax & Insurance",Miscellaneous,Personal Monitoring Service,https://gic.gov.lk/gic/index.php/en/component/info/?id=2031&catid=90&task=info
3,"Banking, Tax & Insurance",Miscellaneous,Procedures of Bank of Ceylon,https://gic.gov.lk/gic/index.php/en/component/info/?id=805&catid=90&task=info
3,"Banking, Tax & Insurance",Miscellaneous,Safe Deposit Lockers,https://gic.gov.lk/gic/index.php/en/component/info/?id=772&catid=90&task=info
3,"Banking, Tax & Insurance",Miscellaneous,BOC I-net Facility,https://gic.gov.lk/gic/index.php/en/component/info/?id=790&catid=90&task=info
3,"Banking, Tax & Insurance",Miscellaneous,Issuing Crackers for Public,https://gic.gov.lk/gic/index.php/en/component/info/?id=1101&catid=90&task=info
3,"Banking, Tax & Insurance",Miscellaneous,Tower Sound Studio,https://gic.gov.lk/gic/index.php/en/component/info/?id=1837&catid=90&task=info
3,"Banking, Tax & Insurance",Bank Accounts,Children Accounts,https://gic.gov.lk/gic/index.php/en/component/info/?id=981&catid=24&task=info
3,"Banking, Tax & Insurance",Bank Accounts,Current Accounts  (Demand Deposit),https://gic.gov.lk/gic/index.php/en/component/info/?id=799&catid=24&task=info
3,"Banking, Tax & Insurance",Bank Accounts,Children Savings Accounts,https://gic.gov.lk/gic/index.php/en/component/info/?id=801&catid=24&task=info
3,"Banking, Tax & Insurance",Bank Accounts,Other Special Savings Accounts Schemes,https://gic.gov.lk/gic/index.php/en/component/info/?id=802&catid=24&task=info
3,"Banking, Tax & Insurance",Bank Accounts,Term Deposits (Fixed Deposit),https://gic.gov.lk/gic/index.php/en/component/info/?id=803&catid=24&task=info
3,"Banking, Tax & Insurance",Bank Accounts,Ordinary Rupee Savings Accounts,https://gic.gov.lk/gic/index.php/en/component/info/?id=800&catid=24&task=info
3,"Banking, Tax & Insurance",Bank Accounts,Wanitha Shakthi Bank Societies,https://gic.gov.lk/gic/index.php/en/component/info/?id=1038&catid=24&task=info
3,"Banking, Tax & Insurance",Bank Accounts,Deposits to Savings Account,https://gic.gov.lk/gic/index.php/en/component/info/?id=724&catid=24&task=info
3,"Banking, Tax & Insurance",Bank Accounts,Opening a Savings Account,https://gic.gov.lk/gic/index.php/en/component/info/?id=723&catid=24&task=info
3,"Banking, Tax & Insurance",Bank Accounts,VISA ELECTRON Debit Card,https://gic.gov.lk/gic/index.php/en/component/info/?id=787&catid=24&task=info
3,"Banking, Tax & Insurance",Bank Accounts,Withdrawals from Minor's Account,https://gic.gov.lk/gic/index.php/en/component/info/?id=727&catid=24&task=info
3,"Banking, Tax & Insurance",Bank Accounts,Withdrawals from the Savings Accounts,https://gic.gov.lk/gic/index.php/en/component/info/?id=725&catid=24&task=info
3,"Banking, Tax & Insurance",Bank Accounts,Opening of a Minors Savings Account / Opening of a HAPPY Children' Savings Account,https://gic.gov.lk/gic/index.php/en/component/info/?id=726&catid=24&task=info
3,"Banking, Tax & Insurance",Bank Accounts,Ordinary Savings Accounts,https://gic.gov.lk/gic/index.php/en/component/info/?id=1836&catid=24&task=info
3,"Banking, Tax & Insurance",Bank Accounts,Ladies' Savings Account,https://gic.gov.lk/gic/index.php/en/component/info/?id=1856&catid=24&task=info
3,"Banking, Tax & Insurance",Bank Accounts,Senior Citizen's Savings Account,https://gic.gov.lk/gic/index.php/en/component/info/?id=1857&catid=24&task=info
3,"Banking, Tax & Insurance",Bank Accounts,Daily Deposit Collection Service,https://gic.gov.lk/gic/index.php/en/component/info/?id=1852&catid=24&task=info
3,"Banking, Tax & Insurance",Bank Accounts,Minor's Savings Accounts,https://gic.gov.lk/gic/index.php/en/component/info/?id=1848&catid=24&task=info
3,"Banking, Tax & Insurance",Bank Accounts,Term Deposit Accounts,https://gic.gov.lk/gic/index.php/en/component/info/?id=1858&catid=24&task=info
3,"Banking, Tax & Insurance",Bank Accounts,RDB Accounts,https://gic.gov.lk/gic/index.php/en/component/info/?id=2367&catid=24&task=info
3,"Banking, Tax & Insurance",Loans,Update of registered Trade Unions,https://gic.gov.lk/gic/index.php/en/component/info/?id=844&catid=25&task=info
3,"Banking, Tax & Insurance",Loans,Obtaining Housing Loans for Low Income Families,https://gic.gov.lk/gic/index.php/en/component/info/?id=666&catid=25&task=info
3,"Banking, Tax & Insurance",Loans,RDB Loans,https://gic.gov.lk/gic/index.php/en/component/info/?id=2368&catid=25&task=info
3,"Banking, Tax & Insurance",Loans,Obtain Educational Loans,https://gic.gov.lk/gic/index.php/en/component/info/?id=813&catid=25&task=info
3,"Banking, Tax & Insurance",Loans,Obtain Loans for Agricultural Purposes,https://gic.gov.lk/gic/index.php/en/component/info/?id=806&catid=25&task=info
3,"Banking, Tax & Insurance",Loans,Small and Medium Enterprises (SME) Loan Scheme,https://gic.gov.lk/gic/index.php/en/component/info/?id=812&catid=25&task=info
3,"Banking, Tax & Insurance",Loans,Income Statement,https://gic.gov.lk/gic/index.php/en/component/info/?id=567&catid=25&task=info
