main_category_id,main_category,subcategory,service,serviceLink
6,Employment Information,"Pensions, EPF, ETF & Other",Widows/Widowers and Orphans Pension Scheme,https://gic.gov.lk/gic/index.php/en/component/info/?id=589&catid=38&task=info
6,Employment Information,"Pensions, EPF, ETF & Other",Payment of Employees’ Provident Fund Benefits on Medical grounds,https://gic.gov.lk/gic/index.php/en/component/info/?id=848&catid=38&task=info
6,Employment Information,"Pensions, EPF, ETF & Other",Payment of Employees’ Provident Fund Benefits for Female Employees on Marriage grounds,https://gic.gov.lk/gic/index.php/en/component/info/?id=847&catid=38&task=info
6,Employment Information,"Pensions, EPF, ETF & Other",Payment of Employees’ Provident Fund Benefits in the event of Death of the member,https://gic.gov.lk/gic/index.php/en/component/info/?id=852&catid=38&task=info
6,Employment Information,"Pensions, EPF, ETF & Other",Payment of Employees’ Provident Fund Benefits upon receiving a Permanent and Pensionable Appointment,https://gic.gov.lk/gic/index.php/en/component/info/?id=850&catid=38&task=info
6,Employment Information,"Pensions, EPF, ETF & Other",Civil Pension Schemes,https://gic.gov.lk/gic/index.php/en/component/info/?id=588&catid=38&task=info
6,Employment Information,"Pensions, EPF, ETF & Other",Payment of Employees’ Provident Fund Benefits upon Restructuring of Government Corporations,https://gic.gov.lk/gic/index.php/en/component/info/?id=851&catid=38&task=info
6,Employment Information,"Pensions, EPF, ETF & Other",Pension Scheme for Journalists,https://gic.gov.lk/gic/index.php/en/component/info/?id=763&catid=38&task=info
7,"Health, Well Being & Social Service",Health Assistance,National Transport Medical Institute,https://gic.gov.lk/gic/index.php/en/component/info/?id=651&catid=39&task=info
7,"Health, Well Being & Social Service",Health Assistance,Medical Assistance for Heart Surgeries,https://gic.gov.lk/gic/index.php/en/component/info/?id=1154&catid=39&task=info
7,"Health, Well Being & Social Service",Health Assistance,Personal Monitoring Service,https://gic.gov.lk/gic/index.php/en/component/info/?id=2031&catid=39&task=info
7,"Health, Well Being & Social Service",Health Assistance,Child Guidance / Psychiatric care for children,https://gic.gov.lk/gic/index.php/en/component/info/?id=1801&catid=39&task=info
7,"Health, Well Being & Social Service",Health Assistance,Child Immunization service,https://gic.gov.lk/gic/index.php/en/component/info/?id=1811&catid=39&task=info
7,"Health, Well Being & Social Service",Health Assistance,"Ear, Nose and Throat (ENT) care for children",https://gic.gov.lk/gic/index.php/en/component/info/?id=1800&catid=39&task=info
7,"Health, Well Being & Social Service",Health Assistance,Medical assistance for kidney transplantation,https://gic.gov.lk/gic/index.php/en/component/info/?id=1641&catid=39&task=info
7,"Health, Well Being & Social Service",Health Assistance,Medical assistance for cancer treatment,https://gic.gov.lk/gic/index.php/en/component/info/?id=1611&catid=39&task=info
7,"Health, Well Being & Social Service",Health Assistance,General medical care for children,https://gic.gov.lk/gic/index.php/en/component/info/?id=1793&catid=39&task=info
7,"Health, Well Being & Social Service",Health Assistance,Dental care for children,https://gic.gov.lk/gic/index.php/en/component/info/?id=1807&catid=39&task=info
7,"Health, Well Being & Social Service",Health Assistance,Neurology care  for children,https://gic.gov.lk/gic/index.php/en/component/info/?id=1795&catid=39&task=info
7,"Health, Well Being & Social Service",Health Assistance,Medical assistance for other surgeries and treatment,https://gic.gov.lk/gic/index.php/en/component/info/?id=1642&catid=39&task=info
7,"Health, Well Being & Social Service",Health Assistance,Language and speech therapy service for children,https://gic.gov.lk/gic/index.php/en/component/info/?id=1897&catid=39&task=info
7,"Health, Well Being & Social Service",Health Assistance,General surgical care for children,https://gic.gov.lk/gic/index.php/en/component/info/?id=1809&catid=39&task=info
7,"Health, Well Being & Social Service",Health Assistance,Eye (Opthalmology)  care for children,https://gic.gov.lk/gic/index.php/en/component/info/?id=1798&catid=39&task=info
7,"Health, Well Being & Social Service",Health Assistance,Skin (dermatology) care for children,https://gic.gov.lk/gic/index.php/en/component/info/?id=1802&catid=39&task=info
7,"Health, Well Being & Social Service",Health Assistance,Accident and animal bite casualty care for children,https://gic.gov.lk/gic/index.php/en/component/info/?id=1853&catid=39&task=info
7,"Health, Well Being & Social Service",Health Assistance,Heart (cardiology) care  for children,https://gic.gov.lk/gic/index.php/en/component/info/?id=1794&catid=39&task=info
7,"Health, Well Being & Social Service",Health Assistance,Ayurvedic Research Institute,https://gic.gov.lk/gic/index.php/en/component/info/?id=959&catid=39&task=info
7,"Health, Well Being & Social Service",Health Assistance,Cardiothoracic surgical care for children,https://gic.gov.lk/gic/index.php/en/component/info/?id=1796&catid=39&task=info
7,"Health, Well Being & Social Service",Health Assistance,Orthopaedic care for children,https://gic.gov.lk/gic/index.php/en/component/info/?id=1799&catid=39&task=info
7,"Health, Well Being & Social Service",Health Assistance,Cancer (oncological) care for children,https://gic.gov.lk/gic/index.php/en/component/info/?id=1808&catid=39&task=info
7,"Health, Well Being & Social Service",Health Assistance,Plastic surgical care for children,https://gic.gov.lk/gic/index.php/en/component/info/?id=1806&catid=39&task=info
7,"Health, Well Being & Social Service",Health Assistance,Physiotherapy service for children,https://gic.gov.lk/gic/index.php/en/component/info/?id=1898&catid=39&task=info
7,"Health, Well Being & Social Service",Health Assistance,Occupational Therapy service for children,https://gic.gov.lk/gic/index.php/en/component/info/?id=1899&catid=39&task=info
7,"Health, Well Being & Social Service",Health Assistance,Out patient medical and surgical care for children,https://gic.gov.lk/gic/index.php/en/component/info/?id=1854&catid=39&task=info
7,"Health, Well Being & Social Service",Health Assistance,Kidney (nephrology) care for children,https://gic.gov.lk/gic/index.php/en/component/info/?id=1797&catid=39&task=info
7,"Health, Well Being & Social Service",Health Assistance,Rheumatological care for children,https://gic.gov.lk/gic/index.php/en/component/info/?id=1805&catid=39&task=info
7,"Health, Well Being & Social Service",Health Assistance,Obtaining Assistance for Illness,https://gic.gov.lk/gic/index.php/en/component/info/?id=570&catid=39&task=info
7,"Health, Well Being & Social Service",Health Assistance,Provision of Herbal Drinks or Herbal Gruel,https://gic.gov.lk/gic/index.php/en/component/info/?id=952&catid=39&task=info
7,"Health, Well Being & Social Service",Health Assistance,Animal Hospital of the National Zoological Gardens,https://gic.gov.lk/gic/index.php/en/component/info/?id=610&catid=39&task=info
7,"Health, Well Being & Social Service",Health Assistance,Nutrition Section of National Zoological Gardens,https://gic.gov.lk/gic/index.php/en/component/info/?id=611&catid=39&task=info
7,"Health, Well Being & Social Service",Health Assistance,Obtaining Relief for Medical Treatment in the case of Injury Sustained in Disaster,https://gic.gov.lk/gic/index.php/en/component/info/?id=879&catid=39&task=info
7,"Health, Well Being & Social Service",Child Care,Child Guidance / Psychiatric care for children,https://gic.gov.lk/gic/index.php/en/component/info/?id=1801&catid=40&task=info
7,"Health, Well Being & Social Service",Child Care,Child Immunization service,https://gic.gov.lk/gic/index.php/en/component/info/?id=1811&catid=40&task=info
7,"Health, Well Being & Social Service",Child Care,"Ear, Nose and Throat (ENT) care for children",https://gic.gov.lk/gic/index.php/en/component/info/?id=1800&catid=40&task=info
7,"Health, Well Being & Social Service",Child Care,General medical care for children,https://gic.gov.lk/gic/index.php/en/component/info/?id=1793&catid=40&task=info
7,"Health, Well Being & Social Service",Child Care,Dental care for children,https://gic.gov.lk/gic/index.php/en/component/info/?id=1807&catid=40&task=info
7,"Health, Well Being & Social Service",Child Care,Neurology care  for children,https://gic.gov.lk/gic/index.php/en/component/info/?id=1795&catid=40&task=info
7,"Health, Well Being & Social Service",Child Care,Language and speech therapy service for children,https://gic.gov.lk/gic/index.php/en/component/info/?id=1897&catid=40&task=info
7,"Health, Well Being & Social Service",Child Care,General surgical care for children,https://gic.gov.lk/gic/index.php/en/component/info/?id=1809&catid=40&task=info
7,"Health, Well Being & Social Service",Child Care,Eye (Opthalmology)  care for children,https://gic.gov.lk/gic/index.php/en/component/info/?id=1798&catid=40&task=info
7,"Health, Well Being & Social Service",Child Care,Skin (dermatology) care for children,https://gic.gov.lk/gic/index.php/en/component/info/?id=1802&catid=40&task=info
7,"Health, Well Being & Social Service",Child Care,Accident and animal bite casualty care for children,https://gic.gov.lk/gic/index.php/en/component/info/?id=1853&catid=40&task=info
7,"Health, Well Being & Social Service",Child Care,Heart (cardiology) care  for children,https://gic.gov.lk/gic/index.php/en/component/info/?id=1794&catid=40&task=info
7,"Health, Well Being & Social Service",Child Care,Cardiothoracic surgical care for children,https://gic.gov.lk/gic/index.php/en/component/info/?id=1796&catid=40&task=info
7,"Health, Well Being & Social Service",Child Care,Orthopaedic care for children,https://gic.gov.lk/gic/index.php/en/component/info/?id=1799&catid=40&task=info
7,"Health, Well Being & Social Service",Child Care,Cancer (oncological) care for children,https://gic.gov.lk/gic/index.php/en/component/info/?id=1808&catid=40&task=info
7,"Health, Well Being & Social Service",Child Care,Plastic surgical care for children,https://gic.gov.lk/gic/index.php/en/component/info/?id=1806&catid=40&task=info
7,"Health, Well Being & Social Service",Child Care,Physiotherapy service for children,https://gic.gov.lk/gic/index.php/en/component/info/?id=1898&catid=40&task=info
7,"Health, Well Being & Social Service",Child Care,Occupational Therapy service for children,https://gic.gov.lk/gic/index.php/en/component/info/?id=1899&catid=40&task=info
7,"Health, Well Being & Social Service",Child Care,Out patient medical and surgical care for children,https://gic.gov.lk/gic/index.php/en/component/info/?id=1854&catid=40&task=info
7,"Health, Well Being & Social Service",Child Care,Kidney (nephrology) care for children,https://gic.gov.lk/gic/index.php/en/component/info/?id=1797&catid=40&task=info
7,"Health, Well Being & Social Service",Child Care,Rheumatological care for children,https://gic.gov.lk/gic/index.php/en/component/info/?id=1805&catid=40&task=info
7,"Health, Well Being & Social Service",Child Care,Complain About Any Rape Cases or Child Abuse,https://gic.gov.lk/gic/index.php/en/component/info/?id=479&catid=40&task=info
7,"Health, Well Being & Social Service",Child Care,Co-ordinating between the  Provincial  Probation and Probation and Child Care Services,https://gic.gov.lk/gic/index.php/en/component/info/?id=1498&catid=40&task=info
7,"Health, Well Being & Social Service",Child Care,Programme for Schooling  of Non-School Going Children,https://gic.gov.lk/gic/index.php/en/component/info/?id=1530&catid=40&task=info
7,"Health, Well Being & Social Service",Child Care,Programmes for Financial Assistance for Twins and Payment of medical Assistance,https://gic.gov.lk/gic/index.php/en/component/info/?id=1568&catid=40&task=info
7,"Health, Well Being & Social Service",Child Care,Ad Hoc Aids for Child Development / Day Care Centers,https://gic.gov.lk/gic/index.php/en/component/info/?id=991&catid=40&task=info
7,"Health, Well Being & Social Service",Social Service,Medical Assistance for Heart Surgeries,https://gic.gov.lk/gic/index.php/en/component/info/?id=1154&catid=41&task=info
7,"Health, Well Being & Social Service",Social Service,Medical assistance for kidney transplantation,https://gic.gov.lk/gic/index.php/en/component/info/?id=1641&catid=41&task=info
7,"Health, Well Being & Social Service",Social Service,Medical assistance for cancer treatment,https://gic.gov.lk/gic/index.php/en/component/info/?id=1611&catid=41&task=info
7,"Health, Well Being & Social Service",Social Service,Medical assistance for other surgeries and treatment,https://gic.gov.lk/gic/index.php/en/component/info/?id=1642&catid=41&task=info
7,"Health, Well Being & Social Service",Social Service,Reserve a Circuit Bungalow,https://gic.gov.lk/gic/index.php/en/component/info/?id=1212&catid=41&task=info
7,"Health, Well Being & Social Service",Social Service,Rehabilitation of Drug Addicts,https://gic.gov.lk/gic/index.php/en/component/info/?id=680&catid=41&task=info
7,"Health, Well Being & Social Service",Social Service,Obtain the services of Mahaweli Center,https://gic.gov.lk/gic/index.php/en/component/info/?id=1210&catid=41&task=info
7,"Health, Well Being & Social Service",Social Service,Samurdhi Social Protection Fund,https://gic.gov.lk/gic/index.php/en/component/info/?id=488&catid=41&task=info
7,"Health, Well Being & Social Service",Social Service,Obtain Samurdhi Stamps,https://gic.gov.lk/gic/index.php/en/component/info/?id=481&catid=41&task=info
7,"Health, Well Being & Social Service",Social Service,Obtaining Equipment for the Handicapped,https://gic.gov.lk/gic/index.php/en/component/info/?id=572&catid=41&task=info
7,"Health, Well Being & Social Service",Social Service,Social Development Programme,https://gic.gov.lk/gic/index.php/en/component/info/?id=484&catid=41&task=info
7,"Health, Well Being & Social Service",Social Service,Elderly and Child Welfare,https://gic.gov.lk/gic/index.php/en/component/info/?id=575&catid=41&task=info
7,"Health, Well Being & Social Service",Social Service,Obtaining Public Assistance,https://gic.gov.lk/gic/index.php/en/component/info/?id=569&catid=41&task=info
7,"Health, Well Being & Social Service",Social Service,Samurdhi Lottery Draw,https://gic.gov.lk/gic/index.php/en/component/info/?id=512&catid=41&task=info
7,"Health, Well Being & Social Service",Social Service,Appeal for Samurdhi relief,https://gic.gov.lk/gic/index.php/en/component/info/?id=590&catid=41&task=info
7,"Health, Well Being & Social Service",Social Service,Saraswathie Pension Scheme,https://gic.gov.lk/gic/index.php/en/component/info/?id=627&catid=41&task=info
7,"Health, Well Being & Social Service",Social Service,Obtaining Probation Assistance,https://gic.gov.lk/gic/index.php/en/component/info/?id=571&catid=41&task=info
7,"Health, Well Being & Social Service",Social Service,Organizing Rural women to establish women societies based on the Gramaseva divisions of the resp,https://gic.gov.lk/gic/index.php/en/component/info/?id=987&catid=41&task=info
7,"Health, Well Being & Social Service",Social Service,Start Herbal Gardens at School/Dhamma School,https://gic.gov.lk/gic/index.php/en/component/info/?id=953&catid=41&task=info
7,"Health, Well Being & Social Service",Social Service,Mobile Medical Clinics,https://gic.gov.lk/gic/index.php/en/component/info/?id=921&catid=41&task=info
7,"Health, Well Being & Social Service",Social Service,Establishment of a Medical Centre,https://gic.gov.lk/gic/index.php/en/component/info/?id=923&catid=41&task=info
7,"Health, Well Being & Social Service",Social Service,Social Development of the Plantation Community,https://gic.gov.lk/gic/index.php/en/component/info/?id=2284&catid=41&task=info
7,"Health, Well Being & Social Service","Grants, Subsidies & Other Assistance",Grant approval to set up Investment Projects,https://gic.gov.lk/gic/index.php/en/component/info/?id=1270&catid=43&task=info
7,"Health, Well Being & Social Service","Grants, Subsidies & Other Assistance",Purchase of Herbal Plants,https://gic.gov.lk/gic/index.php/en/component/info/?id=957&catid=43&task=info
7,"Health, Well Being & Social Service","Grants, Subsidies & Other Assistance","Compensation Payment for Human Deaths, Injuries and Property Loss by Elephants",https://gic.gov.lk/gic/index.php/en/component/info/?id=1098&catid=43&task=info
7,"Health, Well Being & Social Service","Grants, Subsidies & Other Assistance",Causal Relief fund,https://gic.gov.lk/gic/index.php/en/component/info/?id=574&catid=43&task=info
7,"Health, Well Being & Social Service","Grants, Subsidies & Other Assistance",Special Fund,https://gic.gov.lk/gic/index.php/en/component/info/?id=576&catid=43&task=info
7,"Health, Well Being & Social Service","Grants, Subsidies & Other Assistance",Assistance to Writers Project,https://gic.gov.lk/gic/index.php/en/component/info/?id=626&catid=43&task=info
7,"Health, Well Being & Social Service","Grants, Subsidies & Other Assistance",Claiming of compensation by owners of all lands acquired,https://gic.gov.lk/gic/index.php/en/component/info/?id=701&catid=43&task=info
7,"Health, Well Being & Social Service","Grants, Subsidies & Other Assistance",Monthly Assistance to Artiste,https://gic.gov.lk/gic/index.php/en/component/info/?id=628&catid=43&task=info
7,"Health, Well Being & Social Service","Grants, Subsidies & Other Assistance",Obtaining Funds in Case of Emergency,https://gic.gov.lk/gic/index.php/en/component/info/?id=573&catid=43&task=info
7,"Health, Well Being & Social Service","Grants, Subsidies & Other Assistance",Obtaining Housing Relief in the Case of Damage Sustained in Disaster,https://gic.gov.lk/gic/index.php/en/component/info/?id=880&catid=43&task=info
7,"Health, Well Being & Social Service","Grants, Subsidies & Other Assistance",Obtain Kitchen Equipment Subsidy for Broken down Families,https://gic.gov.lk/gic/index.php/en/component/info/?id=877&catid=43&task=info
7,"Health, Well Being & Social Service","Grants, Subsidies & Other Assistance",Subsidy for Craftsmen’s Tools for Craftsmen Who have Suffer From Disaster,https://gic.gov.lk/gic/index.php/en/component/info/?id=878&catid=43&task=info
8,"Agriculture, Livestock & Fisheries",Approval & Registration,Grant approval to set up incentivised Investment Projects,https://gic.gov.lk/gic/index.php/en/component/info/?id=1269&catid=44&task=info
8,"Agriculture, Livestock & Fisheries",Approval & Registration,Grant approval to set up Investment Projects,https://gic.gov.lk/gic/index.php/en/component/info/?id=1270&catid=44&task=info
8,"Agriculture, Livestock & Fisheries",Approval & Registration,SCPPC-Pesticides: Registration of Pesticides,https://gic.gov.lk/gic/index.php/en/component/info/?id=688&catid=44&task=info
8,"Agriculture, Livestock & Fisheries",Approval & Registration,"Registration of Manufacturers of weights, Measures and weighing or Measuring Instruments",https://gic.gov.lk/gic/index.php/en/component/info/?id=927&catid=44&task=info
8,"Agriculture, Livestock & Fisheries",Approval & Registration,"Registration of Sellers of weights, Measures and weighing or Measuring Instruments",https://gic.gov.lk/gic/index.php/en/component/info/?id=929&catid=44&task=info
8,"Agriculture, Livestock & Fisheries",Approval & Registration,SCPPC-Seed Certification: Registration of seed and planting material handlers,https://gic.gov.lk/gic/index.php/en/component/info/?id=1325&catid=44&task=info
8,"Agriculture, Livestock & Fisheries",Approval & Registration,SCPPC-Pesticides: Certification for Pesticides dealers,https://gic.gov.lk/gic/index.php/en/component/info/?id=1327&catid=44&task=info
8,"Agriculture, Livestock & Fisheries",Permits & Licenses,Permit to fell trees,https://gic.gov.lk/gic/index.php/en/component/info/?id=562&catid=45&task=info
8,"Agriculture, Livestock & Fisheries",Permits & Licenses,Obtaining Permits for Transporting Timber,https://gic.gov.lk/gic/index.php/en/component/info/?id=563&catid=45&task=info
8,"Agriculture, Livestock & Fisheries",Permits & Licenses,"Obtaining Transport Permits for Sand Clay, Gravel",https://gic.gov.lk/gic/index.php/en/component/info/?id=1114&catid=45&task=info
8,"Agriculture, Livestock & Fisheries",Permits & Licenses,Obtaining Trade Permit for Sand and Exportable Mineral,https://gic.gov.lk/gic/index.php/en/component/info/?id=1113&catid=45&task=info
8,"Agriculture, Livestock & Fisheries",Permits & Licenses,Obtaining Permit for Mineral Excavation.,https://gic.gov.lk/gic/index.php/en/component/info/?id=1110&catid=45&task=info
8,"Agriculture, Livestock & Fisheries",Permits & Licenses,Obtaining Permit for Mineral Exploration,https://gic.gov.lk/gic/index.php/en/component/info/?id=1111&catid=45&task=info
8,"Agriculture, Livestock & Fisheries",Permits & Licenses,Obtaining Permits for Export Mineral,https://gic.gov.lk/gic/index.php/en/component/info/?id=1112&catid=45&task=info
8,"Agriculture, Livestock & Fisheries","Subsidies & Assistance for Agriculture, Livestock & Fisheries",Investment Assistance for New Planting/Replanting of  Export Agricultural Crops,https://gic.gov.lk/gic/index.php/en/component/info/?id=826&catid=46&task=info
8,"Agriculture, Livestock & Fisheries","Subsidies & Assistance for Agriculture, Livestock & Fisheries",Development Assistance to Ginger and Turmeric,https://gic.gov.lk/gic/index.php/en/component/info/?id=830&catid=46&task=info
8,"Agriculture, Livestock & Fisheries","Subsidies & Assistance for Agriculture, Livestock & Fisheries",Assistance for Productivity Improvement of Low Productive Export Agricultural Crop Lands,https://gic.gov.lk/gic/index.php/en/component/info/?id=827&catid=46&task=info
8,"Agriculture, Livestock & Fisheries","Subsidies & Assistance for Agriculture, Livestock & Fisheries",Obtaining Investment Assistance for a Private Processing Unit,https://gic.gov.lk/gic/index.php/en/component/info/?id=1599&catid=46&task=info
8,"Agriculture, Livestock & Fisheries","Agriculture, Livestock & Fisheries Development",ICC-  Sales of Agriculture publications,https://gic.gov.lk/gic/index.php/en/component/info/?id=1348&catid=47&task=info
8,"Agriculture, Livestock & Fisheries","Agriculture, Livestock & Fisheries Development",Bamboo Plants,https://gic.gov.lk/gic/index.php/en/component/info/?id=1209&catid=47&task=info
8,"Agriculture, Livestock & Fisheries","Agriculture, Livestock & Fisheries Development",SCPPC-Plant Quarantine: Issuing phytosanitary certificate on agricultural commodities,https://gic.gov.lk/gic/index.php/en/component/info/?id=1307&catid=47&task=info
8,"Agriculture, Livestock & Fisheries","Agriculture, Livestock & Fisheries Development",HORDI-Horticultural crops:Training Programmes,https://gic.gov.lk/gic/index.php/en/component/info/?id=1263&catid=47&task=info
8,"Agriculture, Livestock & Fisheries","Agriculture, Livestock & Fisheries Development",ICC-  Duplicating VCD/DVD on agricultural TV programmes broadcasted,https://gic.gov.lk/gic/index.php/en/component/info/?id=1345&catid=47&task=info
8,"Agriculture, Livestock & Fisheries","Agriculture, Livestock & Fisheries Development",ICC- Visits to Agriculture Technology Parks in Gannoruwa and Batatha,https://gic.gov.lk/gic/index.php/en/component/info/?id=1342&catid=47&task=info
8,"Agriculture, Livestock & Fisheries","Agriculture, Livestock & Fisheries Development",HORDI-Horticultural crops: Supply of Horticultural Seed & Planting Material,https://gic.gov.lk/gic/index.php/en/component/info/?id=1262&catid=47&task=info
8,"Agriculture, Livestock & Fisheries","Agriculture, Livestock & Fisheries Development",land for Agricultural Purposes,https://gic.gov.lk/gic/index.php/en/component/info/?id=1204&catid=47&task=info
8,"Agriculture, Livestock & Fisheries","Agriculture, Livestock & Fisheries Development",HORDI-Horticultural crops:Advisory Services to solve farmers problem,https://gic.gov.lk/gic/index.php/en/component/info/?id=1264&catid=47&task=info
8,"Agriculture, Livestock & Fisheries","Agriculture, Livestock & Fisheries Development",Agricultural Development Programme,https://gic.gov.lk/gic/index.php/en/component/info/?id=502&catid=47&task=info
8,"Agriculture, Livestock & Fisheries","Agriculture, Livestock & Fisheries Development",ICC-  Radio programmes in Agriculture,https://gic.gov.lk/gic/index.php/en/component/info/?id=1349&catid=47&task=info
8,"Agriculture, Livestock & Fisheries","Agriculture, Livestock & Fisheries Development",SCPPC-Seed Certification: Registration of fruit plant nurseries,https://gic.gov.lk/gic/index.php/en/component/info/?id=1321&catid=47&task=info
8,"Agriculture, Livestock & Fisheries","Agriculture, Livestock & Fisheries Development",SCPPC-Seed Certification: Registration of seed production crops and certification of produced seeds,https://gic.gov.lk/gic/index.php/en/component/info/?id=1320&catid=47&task=info
8,"Agriculture, Livestock & Fisheries","Agriculture, Livestock & Fisheries Development",FCRDI-Field Crops: Providing breeder seeds of OFC,https://gic.gov.lk/gic/index.php/en/component/info/?id=1281&catid=47&task=info
8,"Agriculture, Livestock & Fisheries","Agriculture, Livestock & Fisheries Development",HORDI-Horticultural crops: Analytical services: Soil & Organic manure analysis,https://gic.gov.lk/gic/index.php/en/component/info/?id=1265&catid=47&task=info
8,"Agriculture, Livestock & Fisheries","Agriculture, Livestock & Fisheries Development","SCPPC:  Issuance of import permits to import plant, planting material and plant products",https://gic.gov.lk/gic/index.php/en/component/info/?id=1284&catid=47&task=info
8,"Agriculture, Livestock & Fisheries","Agriculture, Livestock & Fisheries Development","RRDI-Rice: Dissemination of proven technologies on Plant Protection, Agronomy, etc.",https://gic.gov.lk/gic/index.php/en/component/info/?id=1252&catid=47&task=info
8,"Agriculture, Livestock & Fisheries","Agriculture, Livestock & Fisheries Development",ICC-  agriculture advisory service,https://gic.gov.lk/gic/index.php/en/component/info/?id=1341&catid=47&task=info
